{"literature_check_direction_ids":["direction-3","direction-1"],"reviews":[{"direction_id":"direction-3","fatal_flaw":"none","fatal_flaw_explanation":"No listed fatal flaw applies. The factorial contrast is an exact operational null, held-out combinations make the result non-circular, and the amplitude and pulse-order controls can distinguish additivity from at least the specified saturation alternative. A nonzero contrast alone would not establish a unique cooperative mechanism.","rank":1,"score":{"experimental_discrimination":2,"local_feasibility":2,"negative_result_value":2,"nontriviality":2,"question_specificity":2},"strongest_surviving_claim":"Paired perturbations may exhibit a reproducible distance-lag-order interaction law that violates residual additivity and is not explained by amplitude-matched instantaneous saturation.","survives":true,"total_score":10},{"direction_id":"direction-1","fatal_flaw":"none","fatal_flaw_explanation":"No listed fatal flaw applies. The tests concern observable transformation laws rather than recovery of a planted equation, and refinement plus boundary controls provide distinct outcomes. The result would diagnose symmetry behavior, not identify its physical cause.","rank":2,"score":{"experimental_discrimination":2,"local_feasibility":2,"negative_result_value":2,"nontriviality":2,"question_specificity":2},"strongest_surviving_claim":"Residual responses may contain a transformation-law violation that reproduces across held-out perturbations and cannot be attributed to the measured discretization floor or boundary proximity.","survives":true,"total_score":10},{"direction_id":"direction-4","fatal_flaw":"none","fatal_flaw_explanation":"No listed fatal flaw applies, but the promised local test is only provisionally feasible: resolving long-time behavior, growing recovery times, multiple initial conditions, bidirectional sweeps, and three convergence controls may exceed 30 minutes near a genuine transition.","rank":3,"score":{"experimental_discrimination":2,"local_feasibility":1,"negative_result_value":2,"nontriviality":2,"question_specificity":2},"strongest_surviving_claim":"A refinement-stable branch boundary or sharply growing recovery scale may organize the prediction failures over perturbation amplitude.","survives":true,"total_score":9},{"direction_id":"direction-2","fatal_flaw":"none","fatal_flaw_explanation":"No categorical fatal flaw applies, but the proposed outcomes do not decisively separate local from long-range influence. A spatially local parabolic process such as diffusion can produce nonzero response at arbitrary distance without a finite-speed cone, so an out-of-cone signal does not establish an intrinsically nonlocal interaction. Domain and boundary controls do not repair that missing alternative.","rank":4,"score":{"experimental_discrimination":1,"local_feasibility":2,"negative_result_value":1,"nontriviality":1,"question_specificity":2},"strongest_surviving_claim":"The experiment can measure propagation tails and determine whether apparent distant responses track boundaries or domain-wide normalization, but it cannot infer nonlocality from failure of a finite-speed cone.","survives":false,"total_score":7},{"direction_id":"direction-5","fatal_flaw":"locally_infeasible","fatal_flaw_explanation":"The broad test requires automatically canonicalizing and executing every open-ended quantitative prediction produced by an LLM, yet the available capabilities cover safe equation parsing rather than semantic translation of arbitrary interventions. Without human labeling, a restrictive output language, or substantial new infrastructure, that requirement is not executable within the stated 30-minute local test. A small number of calls also cannot support the proposed statistical comparison of variability.","rank":5,"score":{"experimental_discrimination":2,"local_feasibility":0,"negative_result_value":2,"nontriviality":2,"question_specificity":2},"strongest_surviving_claim":"Representation sensitivity can be tested for a narrow preregistered class of machine-canonicalizable intervention choices and predictions, but not for executable research hypotheses generally under the proposed resources.","survives":false,"total_score":8}],"schema_version":1,"summary":"Directions 3, 1, and 4 survive. Direction 3 supplies the sharpest locally executable null; direction 1 cleanly tests an observable symmetry law; direction 4 is discriminating but has a credible runtime risk. Direction 2 confounds nonlocality with infinite-speed propagation from local dynamics and therefore fails the discrimination threshold. Direction 5 is locally infeasible at its stated open-ended scope. Literature checking is recommended only for directions 3 and 1, where standard factorial-interaction and symmetry-diagnostic precedents pose the most immediate novelty risk among the strongest feasible directions."}